document,topic,nm_producao,ds_resumo,gamma
2719,19,critica de gould ao neodarwinismo a ampliacao do horizonte explicativo da teoria evolutiva contemporanea,a presente dissertacao tem dois objetivos principais o primeiro e explicitar o debate teorico entre a teoria sintetica da evolucao ou neodarwinismo e um de seus principais oponentes o paleontologo e evolucionista stephen jay gould o segundo consiste em avaliar com base na critica gouldiana a real necessidade de alargamento dos explananda da teoria da evolucao e em que medida a expansao naquilo que a teoria deve considerar aponta em direcao a um novo paradigma evolutivo o quadro teorico da teoria sintetica foi elaborado por autores de varias areas ao longo do seculoxx e comecou a ser contestado em meados dos anos pela oposicoes feitas a teoria com base em dados cientificos conflitantes que nao cabem no escopo explicativo neodarwinista gerando novas especulacoes e hipoteses sobre os mecanismos da evolucao a teoria sintetica afirma que a evolucao se realiza lenta e gradualmente tendo a selecaonatural como principal agente nesse processo com as especies se adaptando ao meio dentre as criticas realizadas por gould e seus colaboradores tres sao fundamentais a critica ao ritmo da evolucao ou gradualismo que e efetuada pela teoria do equilibrio pontuado em a segunda e conhecida como critica ao programa adaptacionista empreendida em e e focada sobre a afirmacao de que todas as caracteristicas dos organismos resultam do modo como eles se adaptam para sobreviver e gerar descendencia a terceira critica e uma retomada detalhada dos pontos anteriores para demonstrar o carater contingente do processo evolutivo gould sinaliza a necessidade da revisao e expansao nos pressupostos da teoria evolutiva reconhecendo a relevancia de mecanismos que devem ser levados em conta nas explicacoes evolutivas estes elementos devem ser explicados por uma teoria da evolucao mais completa cobrindo lacunas explicativas que a teoria sintetica e seus postulados nao conseguem resolver nao existe nenhuma nova teoria da evolucao mas sim a necessidade de tornar mais preciso o esquema geral darwiniano adequando a teoria aos fatos que exigem alguma explicacao nao e proposito deste texto explicitar os pormenores da teoria da evolucao pela selecaonatural tal como elaborada por drawin nem se aprofundar em discussoes relativas ao campo da biologia estrita a partir do debate exposto buscaremos avaliar em que medida uma reestruturacao da teoria evolutiva e efetivamente necessaria e se a obra de gould em seu todo oferece um novo modelo ou paradigma para biologia evolutiva e por extensao para toda biologia,0.9754702046947066
3837,19,niveis de selecao uma avaliacao a partir da teoria do gene egoista,esta dissertacao de mestrado aborda a controversia em torno de qual e o nivel biologico no qual a selecaonatural atua com enfase na proposta de richard dawkins do gene egoista e nas questoes que surgem em torno da mesma examinase um panorama de questoes de filosofia da biologia abordadas a partir do problema dos niveis nos quais a selecaonatural atua esperamos que ao avaliar o impacto da teoria do gene egoista na problematica evolutiva consigamos compreender sua importancia o objetivo deste trabalho e filosofico delineando as questoes e clarificando alguns termos do debate sem se propor a tomar partido por uma ou outra posicaoo primeiro capitulo apresenta as origens historicas do debate partindo do ponto de vista original de charles darwin no qual o individuo era a entidade efetivamente selecionada em seguida buscamos entender como novas questoes empiricas em especial a busca de explicacoes biologicas para o altruismo conduziram a propostas de selecao de grupo no segundo capitulo delineamos como o desenvolvimento da genetica possibilitou que um novo nivel de selecao fosse proposto o gene e acompanhamos a exposicao de dawkins sobre o ponto de vista do gene egoista em especial a partir de seus dois livros mais relevantes sobre o tema o gene egoista e o fenotipo estendido o terceiro capitulo examina diversas aproximacoes filosoficas no contexto de resposta a pergunta o que e uma unidade de selecao nosso estudo e consistente com a tese de que as forcas seletivas atuam simultaneamente em diversos niveis,0.9567820300743959
5442,19,a epistemologia naturalizada de quine e sua relacao com a normatividade epistemica,a presente pesquisa tem como objetivo investigar a relacao da epistemologia naturalizada de willard quine com a normatividade epistemologica o projeto epistemologico quiniano surge como um resultado das criticas que quine direciona contra o que podemos chamar de posicao epistemologica tradicional as criticas de quine sugerem que o projeto da epistemologia tradicional com sua pretensao dentre outras de fundamentar as cienciasnaturais deve ser abandonado um dos aspectos fundamentais da posicao tradicional alem do fundacionismo e a normatividade aceitar a sugestao de quine de abandonar as pretensoes da epistemologia tradicional como sendo impossiveis de serem alcancadas  como defendera quine  em favor de uma posicao mais modesta que se encontra dentro do contexto da propria ciencia natural parece obviamente implicar o abandono de todos os elementos ou nocoes que caracterizam a epistemologia tradicional ou seja o fundacionismo a normatividade epistemologica a ideia de uma filosofiaprimeira e a concepcao de conhecimento a priori com isso a epistemologia passaria apenas a fazer descricoes ja que nesta nova perspectiva o conhecimento e entendido como algo natural bastando apenas descrevermos como ele ocorre isso levaria claro a uma extincao da separacao entre ciencia e epistemologia a epistemologia se tornaria uma epistemologia cientifica o problema aqui pode ser formulado na seguinte pergunta por que entao continuar a denominar esse projeto naturalista de epistemologia ja que nao sao mais consideradas as caracteristicas que constituem aquilo que podemos chamar propriamente de epistemologia uma resposta seria a de que quine de modo surpreendente a despeito de suas criticas a toda tradicao epistemologica ira defender a manutencao em seu projeto naturalista daquilo que ele diz ser o elemento caracteristico da epistemologia a saber a normatividade portanto nossa investigacao consistira em saber como quine pretende responder aos criticos e conciliar duas concepcoes que a principio parecem antagonicas naturalismo e normatividade a conclusao que tentaremos apontar consiste em dizer que a normatividade defendida por quine e diferente da normatividade epistemologica dos tradicionais e que ha uma descontinuidade entre ambos os projetos consequentemente a normatividade epistemologica nao podera ser mantida no naturalismo de quine,0.9558330962078653
3390,19,a epistemologia posdarwiniana de sir karl popper,a dissertacao a epistemologia posdarwiniana de sir karl popper pretende esclarecer um ponto especifico na obra do filosofo austrobritanico sir karl popper a funcao desempenhada na epistemologia popperiana pela teoria evolutiva de charles darwin o pensamento popperiano caracterizase por uma rigida defesa da autonomia normativa da epistemologia frente aos dados empiricos entretanto a partir das decadas de e aparecem amiude nas obras de popper referencias ao darwinismo e ao neodarwinismo no contexto de suas reflexoes epistemologicas o filosofo defendera entao uma  epistemologia posdarwiniana  em contraposicao as tradicionais epistemologias de cunho indutivo tais teses geram a pergunta acerca do papel do darwinismo na obra tardia de popper nao seria o caso de popper haver se rendido `a uma forma de naturalismo tomando uma ciencia empirica como base para suas posicoes epistemologicas nossa dissertacao defendera a tese segundo a qual as remissoes ao darwinismo na obra popperiana se dao somente num terreno logicofilosofico nao havendo assim espaco para qualquer especie de naturalismo,0.9553373166084947
3180,19,realismo e falibilismo um contraponto entre peirce e popper,peirce e popper desenvolveram suas filosofias em epocas diferentes e popper teve um contato muito superficial com as obras de peirce insuficiente para que estas pudessem influenciar de modo decisivo o seu pensamento nao obstante ambos desenvolvem teses bastante convergentes acerca da falibilidade da ciencia o presente trabalho compara a teoria dos dois autores buscando destacar seus pontos em comum e suas divergencias sobretudo no que se refere ao realismo que aparece como fundamento necessario a tese do falibilismo a analise empreendida permite concluir que o embasamento do realismo em peirce aparece de modo muito mais consistente que em popper uma vez que aquele enfrenta a questao num espectro bem mais amplo o que o permite propor solucoes para problemas que para popper ainda sao considerados um misterio o realismo mais abrangente de peirce fortalece seu falibilismo enquanto o realismo de popper que nao consegue superar a nocao do senso comum faz com que seu falseacionismo apresente lacunas e inconsistencias que sao discutidas durante o trabalho assim concluise que o falibilismo peirceano engloba o falseacionismo de popper uma vez que discute problemas muito similares e abre caminho para uma discussao mais aprofundada e para solucoes mais abrangentes dos problemas enfrentados por ambos,0.9491201100271035
9995,20,paz guerra e intervencao no pensamento de kant possibilidades e limites do uso da forca no direito internacional,o texto tem por objetivo examinar alguns aspectos do pensamento de kant sobre a guerra analisando a sua eventual admissibilidade os seus limites e a sua funcao no contexto de uma teoria juridicopolitica analisamse conjuntamente os textos de a pazperpetua e da doutrina do direito para a elucidacao dos termos da posicao de kant em relacao ao direito publico e mais especificamente do direito das gentes e do direito cosmopolita para tanto ha uma exposicao dos componentes essenciais do direito publico a saber a ideia de estado juridico a nocao de contrato originario e a ideia de constituicao republicana as diferencas entre os textos de a pazperpetua e da doutrina do direito sao tambem objeto de questionamento aventandose uma explicacao a partir da leitura de interpretes selecionados de acordo com a leitura proposta nesta tese kant reprova moralmente a guerra mas admite a sua existencia no estado de natureza entre as nacoes regido por um direito das gentes meramente provisorio circunscrevendo a admissibilidade do conflito armado a algumas hipoteses especificas e com meios limitados kant admite a autodefesa inclusive em carater preventivo para a finalidade de conservacao da integridade do estado atacado na hipotese de existencia de um inimigo injusto fica clara a funcao da guerra no pensamento de kant com a permissao de promover a remocao forcada do inimigo injusto do estado de natureza interestatal de forma a promover a adocao de uma constituicao e aumentar de forma coercitiva o numero de republicas aptas a instaurar um estado juridico entre as nacoes nessa linha a eventual admissibilidade da guerra guarda conexao com os elementos fundamentais do sistema de direito publico segundo kant devendo servir a promocao de um estado juridico e de uma constituicao republicana embora a guerra nao perca nunca sua conotacaomoralmente negativa ela pode servir como um ultimo meio na aproximacao para a pazperpetua,0.9665950258156669
2635,20,a legitimacao do direito penal origem politicoaxiologico do sistema penal,o objetivo desta dissertacao e procurar os fundamentos do direito penal para tornar a origem deste se fez necessario perquirir seu objeto sem descurar do ser que o investiga bem como de sua atitude metodologica desta forma valemonos do estudo da visao juspositivista do direito portanto avalorativa para romper com seus paradigmas e encontrar na origem do direito positivado uma tarefa politica que externa valores arraigados no exercente do poder o direito penal se funda sobre tres institutos juridicos decorrentes de tres direitos politicos estatais direito de punir proibir e julgar e que portanto constituem os tres pontos fundamentais do sistema punitivo a pena o bem juridico e o processo assim cedico que a atividade legiferante delineia a base do direito penal e que esta externa uma atitude axiologica buscouse com base na teoria dos valores a origem fundante do sistema penal perquirindo os valores que devem nortear o legislador enquanto exercente do poderpolitico ao dispor sobre os tres pontos fundamentais do sistema punitivo desta forma verificouse que o embate entre a ordem publica e o direito de liberdade do cidadao e a origem das teorias que buscam a legitimacao da pena do bem juridico e do processo nao por outro motivo as teorias que pretendem obter da constituicao a carta de valores a serem utilizados como fundamentos axiologicos pelo legislador ganha relevo no cenario do pensamento democratico mundial,0.9479079471679424
6642,20,dignidade da pessoa humana um conceito dentro da perspectiva dos direitos fundamentais inscritos na constituicao federal do brasil e sua contraposicao as decisoes do supremo tribunal federal,abuchaim ricardo rheingantz dignidade da pessoahumana um conceito dentro da perspectiva dos direitosfundamentais inscritos na constituicao federal do brasil e sua contraposicao as decisoes do supremo tribunal federal f dissertacao mestrado em filosofia programa de posgraduacao em filosofia instituto de filosofia sociologia e politica universidade federal de pelotas o postulado da dignidadehumana encontra assento textual na constituicao federal do brasil de como tal e vetor axiologico das condutas estatais de administrar legislar e julgar ocorre que nao ha consenso sobre o conteudo da dignidadehumana apresentado no referido diploma constitucional tratandose de um conceito em construcao pelo supremo tribunal federal atraves de seus julgados que analisam os denominados direitos e garantias fundamentais imperioso portanto que se advogue por criterios que permitam a fixacao de um conteudo minimo para a citada postulacao com vistas a manutencao de um estado de previs,0.943712105927956
6403,20,para a construcao da legitimidade pelas vias da integracao normativismo para uma cooperacao internacional sustentavel,as ultimas decadas do sec xx e o comeco do sec xxi estabelecem o limiar para uma mudanca de cenario nas relacoesinternacionais com os sinais indicativos de uma ordem mais multilateral com a disseminacao das normas internacionais seja em relacao ao comercio como em relacao ao direito novos paises sao criados e admitidos nas organizacoes interestatais assim como a ha diminuicao dos riscos de uma guerra termonuclear entre as potencias globais contudo em meio as evidencias de um multilateralismo a persistencia de velhos problemas e o surgimento de novos desafios continuam a impor resistencia para uma arena internacional mais estavel e pacifica com isso tentase demonstrar que a concepcao da teoria da cooperacao neoliberal com os seus pressupostos e a sua ontologia determina a formacao de um equilibrio que apresenta propensao a conduzir para um modelo de eficiencia muito pouco estavel assim sendo defendese a hipotese de que com o modelo apresentado e a sua ontologia nao objetivam a resolucao dos,0.9374065013362104
5009,20,o olhare cosmopolita a atualidade da proposta kantiana para a paz perpetu,ao se tratar da filosofia do direito em kant especialmente do problema da paz objetivase neste trabalho de pesquisa discutir se a proposta kantiana de pazperpetua ainda e possivel duzentos anos depois de ser escrita em um mundo traumatizado por duas guerras mundiais os direitoshumanos eclodem como um signum prognosticum de que os sereshumanos estao progredindo para uma construcao de uma sociedade de paza proposta comospolita se insere no processo de globalizacao das ultimas decadas com o renascimento do jusnaturalismo na esfera juridica internacional como mecanismo eficaz para a construcao de uma sociedadecivil global de paz bem como para preparar o caminho o caminho para uma possivel existencia de uma federacao mundial de estados,0.9230270110656803
5904,21,nietzsche e a transvaloracao dos valores decadentes do alemdohomem ao tipo nobre,ulguim daltro lucena nietzsche e a transvaloracao dos valoresdecadentes do alemdohomem ao tipo nobre fls dissertacaomestrado programa de posgraduacao em filosofiamoral e politica universidadefederal de pelotas rsessa investigacao procurou resolver a questao como relacionar o alemdohomem ao tipo nobre para discutir as condicoes de possibilidade da transvaloracao dos valores vigente utilizouse a tarefa da transvaloracao como ponte rumo a valores nobres preponderando sobre as demais supondo que fosse o elo entre o alemdohomem e do tipo nobre para discutir as condicoes de possibilidades da superacao dos valores decadentes vigentes nietzsche havia cunhado o termo alemdohomem e este seria o comandantechefe para a tarefa da transvaloracao mas encontrou dificuldades para a criacao de uma moral do alemdohomem e mais ainda de tornala efetiva todavia o conceito do alemdohomem serviu como lente teorica filosofica para tornar visivel o nobre pois nietzsche ja havia esbocado antes o conceito verificouse que o homem superior nao pode ser comparado com o alemdohomem porque este e um instrumento que torna visivel o tipo nobre o alemdohomem nao pode ser comparado com o tipo nobre porque a partir do metodo genealogico nietzsche oferece melhores condicoes para a efetivacao dos valores do tipo nobre do que os do alemdohomem o tipo nobre nao e o filosofo do futuro ou mesmo os novos filosofos mas fornece para estes as condicoes e ferramentas os valores nobres para efetivar a transvaloracao dos valores decadentes embora o filosofo do futuro e o tipo nobre sejam espiritos livres eles tem funcoes diferentes o filosofo do futuro e um formador de valores nobres e o tipo nobre e a efetivacao do espiritolivre a concretude dos valores de tipo nobre por fim todas as caracteristicas citadas sobre a moral dos senhores e moral dosescravos sao percebidas com especial atencao por nietzsche na construcao de valores do homem nobre os novos filosofos utilizarao este novo modo de valorar como ferramenta para a formacao de um novo tipo de homem o tipo nobre um homem de espiritolivre,0.967327605943392
4414,21,nietzsche a moral da exaltacao do tipo forte,propomonos a apresentar nesta pesquisa uma exposicao acerca da moral preconizada por nietzsche nietzsche faz uma profunda critica a moral ocidental platonicojudaicocrista pois segundo ele o ocidente vive uma moral castradora que oprime as forcas instintivas e naturais da vida esta e a moral dos fracos dos ressentidos uma moral que impede o homem de alcancar o seu desenvolvimento pleno e realizar ao maximo suas potencialidades em contrapartida nietzsche apresenta a moral que expressa o otimismo pelas forcas vitais do homem forcas essas que animam e impelemno a alcar o supremo brilho e potencia proprios do homem em torno dessa concepcao procuramos apresentar em que aspectos a moral ocidental oprime a expansao da vida qual e a origem do estado depressivo e da fraqueza de vontade que estao presentes em nossa cultura apontando como possivel resposta a indicacao nietzscheana de que a decadencia do ocidente esta na repressao das forcas instintos e naturais do homem por outrolado buscamos explorar como se apresenta a moral denominada por nietzsche de moral nobre a verdadeira moral que possibilita um viver mais saudavel autentico e intenso para o homem permitindoo desenvolverse elevarse ao maximo chegando ao estado evoluido do homem do tipo forte para nietzsche a realizacao plena do homem e conseguida atraves da afirmacao da forcas naturais da afirmacao da vontade de poder,0.9591794615097069
7404,21,o papel de zaratustra na filosofia de nietzsche do meio dia ao grande meiodia,mignoni neomar sandro o papel de zaratustra na filosofia de nietzsche do meiodia ao grande meiodia p dissertacao mestrado em filosofia universidade estadual do oeste do parana toledo resumo tratase de uma investigacao acerca do papel desempenhado pela personagem de zaratustra no contexto da obra madura de nietzsche sobretudo no que se refere ao meiodia e grande meiodia por reconhecer que o periodo tardio da filosofia nietzschiana e marcado pela proposta afirmativa de uma transvaloracao de todos os valores o presente estudo dedicase a compreender o itinerario percorrido pela personagem frente ao meiodia enquanto inicio da tarefa da personagem e o grande meiodia enquanto celebracao que consuma sua incorporacao do eternoretorno do mesmo e a efetivacao definitiva da transvaloracao de todos os valores em vista disso a primeira secao busca evidenciar a critica nietzschiana a culturaocidental marcada pelo niilismo e a morte de deus tal qual ela se apresenta no crepusculo do,0.9559170569617523
6281,21,sobre a genealogia da moral de nietzsche,na presente dissertacao dedicamonos a analise do trabalho realizado por friedrich nietzsche em sua genealogia da moral uma polemica destacando a ideia de transvaloracao de todos os valores apresentada em tal obra acompanhamos o percurso do filosofo neste escrito desde sua investigacao a respeito da origem dos pares de conceitos bom e ruim e bom e mau ate sua conclusao sobre a preferencia do homem por querer o nada a nada querer inicialmente analisamos os conceitos morais colocados em questao por nietzsche ate alcancarmos os ideais que os fundamentam e constatarmos que eles estao a servico de uma saude fraca que luta agonicamente pela vida em seguida elucidamos os motivos e os perigos de uma disseminacao de tal fraqueza entre os homens que compoem o substrato cultural analisado na obra em questao por fim refletimos sobre duas ocorrencias que emergem a partir deste movimento cultural tornando possivel uma transvaloracao dos valores que pautam a moral investigada a autoconscientizacao da vo,0.9552982119121534
4594,21,o cristianismo como religiao da decadence e contraria aos impulsos vitais em o anticristo de nietzsche,esta dissertacao trata da concepcao do cristianismo como manifestacao de um fato fisiologico denominado decadence tal como explicitado por nietzsche em o anticristo a religiaocristao e entendida como sintoma de um processo de desestruturacao fisologica cujos ideiais atuam como instrumento de conservacao e promocao da corrupcao vital alem disso considerase a tarefa do filosofo de remontar o fenomeno religiosos cristao as suas condicoes de origem solo judaico e distinguir entre cristianismo eclesial cujo fundador e o apostolo paulo e cristianismo autentico ensinado e vivido por jesus de nazare cuja tipologia fisiologica e analisada cada paradigmatico de degenerescencia dos instintos vitais o cristianismo e entendido como o substrato dos valores da civilizacao ocidental em especial a moderna,0.9529113067256859
