document,topic,nm_producao,ds_resumo,gamma
3218,37,teorias da justificacao do conhecimento uma analise do confiabilismo de alvin goldman,esta dissertacao trata da possibilidade do conhecimento proposicional investiga o que seja crenca justificada partindo da definicao platonica de conhecimento objetiva aprofundar a compreensao das argumentacoes referentes a justificacao do conhecimento tendo como eixo o confiabilismo de alvin goldman pretendemos investigar as contribuicoes de algumas teorias epistemologicas contemporaneas ao estabelecimento da definicao de conhecimento proposicional e junto com a busca de uma definicao dessas ordem procura uma interpretacao e definicao mais adequada de crenca justificada ja que nao parece ser possivel uma adequada definicao sobre o que seja conhecimento se mconsiderar as questoes que envolvam crencas e em se tratando de conhecimento proposicional crencas justificadas tratamos nao somente de crencas justificadas mas tambem verdadeiras apresentamos as contribuicoes a definicao de conhecimento de alfred ayer roderick chisholm e de bertrand russel como tentativas de melhorar a definicao tradicional discutimos o problema de gettier apresentado em is justified true belief knowledge no qual questiona as tentativas de definicao que fosse plausivel defende a nocao de conhecimento como nao sendo apenas crenca verdadeira e justificada tratamos o que vem a ser justificacaoepistemica fazendo mencao a um entendimento do conhecimento intitulado internalismo e externalismo em epistemologia apresentamos a solucao de alvin goldman enfatizando a versao do seu artigo what is justified belief e sua versao mais acurada apresentada em epistemology and cognition fazendo mencao tambem a outros de seus textos analisamosassim alguns pontos de confiabilismo de goldman apresentando sua enfase nos processos formadores de crencas e naquels que permitem novos processos para a origem de novas crencas defendemos a grantia do conhecimento proposicional a partir de seu impreterivel vinculo a norigem da crenca em processos que sejam confiaveis apresenta a avaliacao e criticas de susan haack descrita em seu evidence and inquiry discute a versao de crenca justificada segundo ernest sosa em reliabilism and intellectual virtue e as criticas feitas a goldman a pesquisa estabelece contrapontos entre alguns importantes autores contemporaneos a respeito d aproblematica do conhecimento e da crenca justificada conclui que a proposta confiabilista de goldman aparentemente e excelente mas que feito um estudo com maior propriedade mostrase bastante fragil e com muitos problemas por esta razao nao consegue estabelecer passo seguro e grantido a superacao do proglema de gettier e seus correlatos,0.9731432329203087
8348,37,o problema de gettier e a epistemologia do raciocinio,reza a lenda que ate o inicio da segunda metade do seculoxx a comunidade filosofica aceitava tacitamente desde os primordios uma definicao tripartite de conhecimento remontando aos textos platonicos segundo a qual conhecimento e crenca verdadeira justificada em porem o filosofo edmund gettier publicou um artigo refutando essa definicao atraves de dois contraexemplos ele mostrou que ha casos nos quais e possivel que acreditemos veraz e justificadamente em uma proposicao sem que tenhamos conhecimento dela o problema de gettier exige que compreendamos como a analise tradicional platonica deve ser alterada de modo que os contraexemplos criados por gettier nao constituam contraexemplos a analise modificada nesta dissertacao vamos examinar uma das respostas a esse problema a teoria da anulabilidade de peter klein esperamos ao fim da apresentacao da teoria de klein ter oferecido ao leitor boas razoes para crer que a teoria da anulabilidade oferece uma analise do conhecimento interessante e promissora em muitos aspectos nao obstante objecoes ainda nao respondidas colocandose assim entre as melhores candidatas para a solucao do problema de gettier recentemente contudo uma grande ameaca se impoe ao anulabilismo de klein o problema do conhecimento via falsidade nos ultimos dez anos um bom numero de ostensivos casos de conhecimento inferencial com base em crencas falsas foi posto em circulacao indo de encontro a enraizada tese aristotelica sobre conhecimento inferencial segundo a qual conhecimento inferencial so e produzido por crencas verdadeiras que sao casos de conhecimento nossa ultima tarefa sera entao entender como o anulabilismo de klein acomoda o novo dado epistemologico da possibilidade de haver conhecimento com base em falsidades,0.9716695513656634
5369,37,autoengano e delirio dois ensaios sobre crencas e racionalidade,a dissertacao e composta por dois ensaios que apesar de autossuficientes possuem um objeto comum o estudo dos limites de aplicacao do conceito de crenca mediante o exame de fenomenos que desafiam a atribuicao de crencas aos sujeitos em que se manifestam os fenomenos escolhidoso autoengano e os delirios estudados pela psiquiatriasao exemplos de estadosmentais cuja inaptidao a desempenharem plenamente o papel funcional tido como essencial para que um estado mental seja uma crenca poe em duvida tanto o estatuto de crenca dito doxastico desses estados quanto os criterios para a atribuicao desta categoria psicologica portanto as questoes fundamentais que norteiam estas investigacoes sao que especie de estado mental constituem esses fenomenos estamos autorizados a classificar como crencas estados anomalos que ostensivamente violam as normas da racionalidadeno que dizrespeito ao autoengano foi analisado um argumento contra a opcao de classificar como doxasticos os estadosmentais caracteristicos desse fenomeno tal argumento parte da premissa de que seja uma caracteristica essencial das crencas que essas visem a verdade e aponta que qualquer que seja o tipo de estado produzido pelo autoengano esse nao satisfaz tal condicao procurei mostrar uma deficiencia fundamental nesse argumento a saber que a suposta teleologia da crenca nao acarreta a impossibilidade de estados que apesar de essencialmente voltados a uma correspondencia com o mundo sao impedidos de atingir o seu objetivo por processos extrinsecos a tal caracteristica essencial a partir disso uma proposta positiva foi discutida que substituiria a concepcao doxastica do autoengano pela caracterizacao deste como uma forma de imaginacao proposicional foi apontado que qualquer candidato a substituir a crenca nesse contexto explanatorio deveria no minimo desempenhar o mesmo papel que a crenca na producao de acoes subsequentemente foi examinada uma tentativa de equacionar os poderes motivacionais da crenca e da imaginacao concluindose que tal tentativa esta enredada em uma ambiguidade enfim foi apresentado um argumento que pretende estabelecer que nenhuma atitude cognitiva possui papel motivacional sem a presenca de uma crenca de fundocrencas nao apenas em conjuncao com desejos causam e racionalizam acoes mas tambem determinam se e quando se age com as outras atitudes como inputs cognitivos em escolhas e no raciocinio pratico a primeira investigacao portanto consiste na avaliacao de razoes a favor e contra a concepcao doxastica do autoengano e o resultado obtido foi que os argumentos e propostas examinados nao sao suficientes para suplantala ainda se o papel motivacional de todas as atitudes cognitivas que nao sao crencas de fato depende da existencia de uma representacao doxastica do cenario pratico entao a proposta de classificar o resultado do autoengano como um conteudo imaginado e derrotada pois atribuir ao sujeito em autoengano uma representacao do cenario pratico relevante que ele justamente precisa ignorar conduziria a um paradoxono que dizrespeito aos deirios foi analisada uma tentativa de fugir aos ataques a concepcao doxastica desses estados por meio da adocao de uma teoria que flexibilizasse os criterios para a atribuicao de crencas a teoria analisada equipara crencas a conjuntos de disposicoes estereotipicas de tres tipos principais comportamentais fenomenais e cognitivas que podem manifestarse em diferentes graus assim crer que algo e o caso nada mais seria que corresponder em um grau adequado e em certos aspectos adequados ao estereotipo disposicional para crenca na proposicao relevante e uma caracteristica importante dessa teoria e a postulacao de que o que contara como adequado dependera do contexto de atribuicaoo que podese inferir incluira o publico que desejamos informar com a atribuicao relevante ademais essa teoria propoe que atribuiremos a um sujeito crenca em uma determinada proposicao sempre que as maneiras como esse sujeito se afasta do estereotipo possam ser facilmente explicaveis ou desculpaveis por apelo a alguma caracteristica anomala na situacao em que ocorrem portanto essa teoria parece acolher a concepcao doxastica dos delirios sob a condicao de que encontremos desculpas para todos os modos nos quais os sujeitos deixam de manifestar as disposicoes estereotipicas de crenca no conteudo deliroide relevante ademais foi observado que o apelo a dependencia em relacao ao contexto nao serve ao proposito de uma defesa da concepcao doxastica pois haverao contextos nos quais a atribuicao de crencas genuinas nao sera a opcao mais razoavelcontextos nos quais um verdadeiro disposicionalista nao vera problema algum em ao inves de induzir seu publico em erro simplesmente especificar em maior detalhe as disposicoes manifestas pelo sujeito da atribuicao foram considerados possiveis candidatos as caracteristicas anomalas e examinadas respostas possiveis as objecoes contra a concepcao doxastica dos delirios tendose concluido que o disposicionalismo nao auxilia a defesa desta mas antes resulta em uma concepcao empobrecida da atribuicao de estados anomalos em geral por fim ofereci uma sucinta defesa da ideia de que a tentativa de usar categorias da psicologia do senso comum para classificar estados anomalos e futil e que devemos antes cuidar de detalhar nossa compreensao das disposicoes envolvidas nesses estadospalavraschave atitudes proposicionais autoengano crenca delirio disposicoes irracionalidade motivacao imaginacao,0.9695473696189021
10903,38,wagner e nietzsche reflexoes sobre o drama musical grego,perdigao thiago wagner e nietzsche introducao ao drama musical grego dissertacao mestrado  programa de posgraduacao em filosofia universidade federal de pelotas pelotas a presente dissertacao tem como objetivo organizar e analisar os desdobramentos do conceito de drama musical grego na obra de richard wagner e friedrich nietzsche sobretudo no periodo que abarca os anos de e em relacao a obra de nietzsche e as decadas anteriores a isso no que dizrespeito as obras de wagner qual o caminho percorrido pelo conceito de drama musical grego dentro da obra de wagner qual a concepcao de drama musical grego na obra de nietzsche em tal periodo o conceito de drama musical presente na obra de wagner influenciou a interpretacao de nietzsche a respeito do mesmo conceito em que medida o drama musical grego foi trazido a modernidade por wagner sendo o drama musical grego o cerne do trabalho questoes secundarias serao tratadas tais como a uniao das artes dentro do drama musical e da opera as hierarquias entre as artes propostas pelos autores e outras varias questoes sobre estetica tambem serao abordados como temas secundarios alguns autores que influenciaram tanto wagner quanto nietzsche como schopenhauer platao os tragediografos gregos e outros,0.9685433138842774
4636,38,cinco prefacios para cinco livros nao escritos de friedrich nietzsche distanciamento em relacao a richard wagner,o texto de friedrich nietzsche cinco prefacios para cinco livros nao escritos finalizado em dezembro de pode ser lido como um documento que atesta uma reserva que se tornaria crescente entre o filosofo friedrich nietzsche e o compositor richard wagner e que ira culminar no posterior rompimento da relacao de proximidade que ambos cultivavam no periodo de redacao do primeiro livro de nietzsche o nascimento da tragedia finalizado em dezembro de o interesse dos cinco prefacios para cinco livros nao escritos reside no fato de que embora sendo caracterizado como pertencendo a primeira fase de producao de nietzsche este texto ja esboca muitos dos temas que nietzsche desenvolveria na sua busca por uma filosofia propria de que seu segundo livro humanodemasiadohumano publicado em ja e fruto os prefacios suscitam ainda a discussao de um traco muito caracteristico da filosofia de nietzsche que parece aqui pela primeira vez ganhar expressao o carater fragmentario e a incompletude intencional de sua obra assim uma das principais intencoes desta pesquisa consistiu na fundamentacao conceitual pela investigacao da obra publicada e dos fragmentos postumos da observacao da procura de nietzsche por uma filosofia propria e o quanto o rompimento com richard wagner do ponto de vista biografico pode ter de significativo para isso,0.9658193149494293
6379,38,o beethoven de wagner em o nascimento da tragadia de nietzsche,esta dissertaaa£o tem como objetivo mostrar a recepaa£o do beethoven de wagner na obra de nietzsche mais precisamente em seu livro o nascimento da traga(C)dia wagner tenta explicar aos alema£es as razaes de beethoven figurar no mesmo patamar de goethe e schiller wagner utilizase de uma exposiaa£o do homem e do gaªnio beethoven para chegar a esta conclusa£o a partir de uma breve analise da nona sinfonia podemos perceber porque esta obra foi ta£o importante para wagner dar sequaªncia em seu drama musical e justamente nesta junaa£o que houve da palavra com a maºsica na composiaa£o de beethoven a(C) que nietzsche vaª a importa¢ncia destes dois compositores alema£es utilizandoos para sua primeira obra em resumo mostraremos a apropriaaa£o que nietzsche realiza na£o apenas do texto beethoven mas de wagner e de schopenhauer para explicar a questa£o musical no nascimento da traga(C)dia,0.9594294662589455
7209,38,o jovem nietzsche o medico da cultura,o objetivo desta tese e analisar a filosofia de juventude de friedrich nietzsche a luz do problema da cultura da mesma forma que critica duramente a cultura de sua epoca considerandoa empobrecida sem meta e sem substancia nietzsche tambem sinaliza e oferece caminhos que segundo ele seriam capazes de promover um redimensionamento e revitalizacao desta mesma cultura assim o texto o jovem nietzsche medico da cultura defende a tese de que a filosofia nietzschiana e uma filosofia medica que tanto procura identificar os sintomas e origem da doenca cultural moderna realizando assim um diagnostico quanto prescrever medicamentos capazes de neutralizar a doenca e revitalizar a saude da cultura do seculo oitocentista se a alemanha recemunificada padecia de um filisteismo cultural generalizado de um otimismo vulgar empobrecedor e de um apequenamento do humano grandes naturezas tragicas como teriam sido arthur schopenhauer na filosofia e richard wagner na arte surgiriam como remedios capazes de reabilitar e,0.9571406711294109
7357,38,wagner e nietzsche o problema da arte em torno da musica,esta dissertacao e o resultado da pesquisa dedicada ao confronto filosofico e estetico dos perfis de richard wagner e friedrich nietzsche cujo objetivo foi a elucidacao da critica do filosofo ao artista a execucao do trabalho investigativo demandou o manuseio das fontes bibliograficas primarias constituidas pelos principais escritos desses dois expoentes da cultura alema do seculoxix com maior atencao para o beethoven e a arte e a revolucao de wagner e o nascimento da tragedia wagner em bayreuth e o caso wagner a argumentacao se deteve na contextualizacao do ambiente artistico alemao da epoca em questao para tanto foi necessaria uma digressao aos fundamentos classicos da arte extraidos do mundo grego fonte comum de inspiracao para o filosofo e para o artista outro ponto comum entre ambos foi a filosofia de schopenhauer que impulsionou a filosofia de nietzsche e a musica de wagner durante o periodo de juventude nietzsche identificava no pensamento de wagner os tracos do movimento artistico em tom,0.9485105408747495
1904,39,o livro de arte de cennino cennini transcricao dos manuscritos traducao e comentarios,o livro de arte de cennino cennini traz predominantemente preceitos tecnicos de pintura de um discipulo longinquo de giotto o inicio do tratado esta repleto de topicas cristas da latinidade letrada e artisticas podendose identificar aqui e ali ressonancias de horacio cicero quintiliano dante boccaccio petrarca alem da biblia e de outros textos teologicos a definicao de pintura de cennino cennini envolve fantasia e a operacao de mao no retratar as coisas a partir dos exempla da natureza o livro de arte inicia os preceitos tecnicos apresentando os materiais envolvidos no desenhar e no colorir base da arte da pintura segundo cennini o desenho enquanto ars e ingenium precede o colorir e o rilievo e produzido ja a partir dele a maior parte dos preceitos referese a pinturas em madeira em parede a fresco e a seco em tela mas o livro de cennini trata tambem de como fazer relevos e moldar com gesso com metal como pintar tecidos como fazer e ornar vestimentas de cavalaria como pintar em vidro etc o livro de arte e um dos ultimos tratados de arte a ter parentesco com a tratadistica medieval e antecede toda uma outra forma de se escrever sobre arte a ser inaugurada por alberti,0.9538381188851411
7042,39,investigacoes acerca do conceito de arte,no ultimo seculo foram apresentadas tantas formas inovadoras do que pode ser designado pelo termo arte que esse conceito se tornou relativo e problematico ate o seculoxix os materiais e modos de representacao tradicionais operavam como indicadores que anunciavam algo como uma obra de arte o alargamento dessas configuracoes e o abandono dos principais padroes da arte tradicional sao acontecimentos historicos que conduzem naturalmente a questoes como o que ha em comum entre essa diversidade de dados para que ainda possam ser agrupados sob o nome arte e possivel encontrar uma definicao para a arte a que nos referimos quando utilizamos essa palavra mais ainda diante do mercado de investimentos em arte e da proliferacao de museus criticos e curadores o que entendemos por arte se resume ao conjunto de obras de arte reconhecidas historicamente e institucionalmente como tal defenderemos a tese de que arte e uma palavra que circunscreve dois conceitos relacionados porem distintos um e mais rest,0.9443881483953622
3788,39,luigi pareyson e a estetica da formatividade um estudo de sua aplicabilidade a poetica do readymade,diante da dificuldade de analise das vanguardas artisticas pelo vies das esteticas tradicionais aproximar uma estetica contemporanea de uma poetica que representa uma verdadeira ruptura na historia da arte luigi pareyson propoe que se pense a arte a partir da otica do artista mas sem perder o carater filosofico que a estetica exige desse modo a estetica da formatividade se mostra inovadora e passivel de ser aproximada de uma poetica dificil de ser analisada pelas esteticas tradicionais o redymade de marcel duchamp por meio da teoria da formatividade e possivel esmaecer a rigida distincao entre arte nao arte aproximando a arte da vidacotidiana sem retirar o carater de autonomia da autentica arte ao deslocar objetos cotidianos para o ambito da arte duchamp recria o conceito de arte e reinventa o modo de conceber a arte ao negala atraves da estetica da formatividade podese fazer uma rica leitura desta poetica alem de elucidar os conceitos pareysonianos por meio de uma instigante aplicacao,0.9424386052762895
8929,39,o que e a arte sera a teoria institucional promissora,o problema de saber definir um determinado conceito tem sido uma das tarefas mais proeminentes da filosofia as diversas tentativas de definir arte geraram intensos debates na estetica e na filosofia da arte analitica formalismo e expressionismo sao algumas das varias teorias candidatas para tentar solucionar o problema ha quem defenda que e sequer possivel definir arte enquanto outros discordam quanto ao que ha para definir a palavra arte objetos que sao arte arte em sentido classificativo ou arte em sentido valorativo entre as tentativas de definir arte a teoria e a definicao institucional de arte de george dickie foi uma das mais discutida entre os filosofos analiticos do secxx embora a ideia de focar no enquadramento social das artes nao seja original e merito de dickie ter sistematizado rigorosamente as ideias apresentadas anteriormente e sobre elas ter formulado algumas das mais sofisticadas definicoes de arte no campo da filosofiaanalitica em essenciaa qualquer versao da definicao instit,0.9391988839796706
10238,39,sobre o conceito de obra de arte em arthur danto,a presente dissertacao tem como objetivo principal investigar o conceito de obra de arte proposto por arthur coleman danto com a finalidade de verificar a sua capacidade de diferenciar as meras coisas das obras de arte como se sabe danto desenvolve suas reflexoes sobre a artecontemporanea sob o impacto que lhe causaram as producoes de alguns artistas da pop art norteamericana este trabalho pretende investigar a concepcao de obra de arte proposta por danto tendo em vista as sucessivas formulacoes de suas teorias e algumas criticas que lhe foram feitas embora a abordagem filosofica de danto sobre a arte supere a tarefa de definicao limitarei o escopo desta pesquisa a definicao de seu conceito de obra de arte e a algumas nocoes que ele apresentou e que de alguma forma tornaramse bem conhecidas na discussao contemporanea da diferenca entre obras de arte e meras coisas reais,0.9386157039518129
10439,40,a nocao de parhemas na filosofia de epicuro o que pode o homem,para epicuro de samos parhemas nosso poder designa o poder humano de conhecer deliberar e agir livremente a nocao de parhemas distingue fundamentalmente o atomismo epicurista do atomismo presocratico sendo fator indispensavel para a construcao da filosofia de epicuro esta tese e produto da interpretacao da filosofia epicurista a partir da analise dos textos gregos de epicuro discipulos doxografos e pesquisa bibliografica o objetivo deste trabalho e apresentar uma interpretacao do epicurismo a partir da nocao de parhemas enquanto componente das bases do pensamento epicurista delimitando seu sentido aspectos e o uso que dela faz epicuro na estruturacao de seu pensamento dividida em tres capitulos a tese comeca por destacar os sentidos aspectos e relevancia da nocao de parhemas no epicurismo o segundo capitulo trata da funcao primordial que parhemas assume na reformulacao do atomismo presocratico e de como essa nocao articula as partes da filosofia de epicuro em um conjunto coerente por fim enfatizase o papel das nocoes de limite ilimitado e variacao para a compreensao das distincoes enunciadas por epicuro entre acaso necessidade e parhemas concluise que as consideracoes epicuristas sobre o poder cognitivo deliberativo e causal do homem integram o fundamento da critica dos epicuristas aos primeiros atomistas e sao o ponto de partida e fator articulador das partes da filosofia de epicuro,0.9605135142704028
8616,40,uma caracterizacao das nocoes de particulares e universais,o objetivo central desta tese e caracterizar as nocoes de particulares e universais procuro distinguir o problema de definir ou caracterizar as nocoes de particulares e universais do problema de distinguir fundamentalmente as entidades entre particulares e universais eu procuro fornecer um tratamento ao primeiro problema enquanto o segundo problema sera considerado de maneira secundaria a tese possui tres capitulos no primeiro deles procuro discutir de uma maneira geral as teorias ontologicas sobre particulares e universais o objetivo e selecionar as entidades que sao relevantes paras as teorias ontologicas sobre particulares e universais pelo menos as que julgo mais relevantes no debate contemporaneo no segundo capitulo trato da discussao sobre a distincao fundamental entre entidades particulares e universais discuto as ideias de ramsey e macbride sobre a possibilidade de tal distincao busco concluir que a questao sobre a distincao fundamental entre particulares e universais,0.933626583675232
4470,40,eleutheria a nocao de liberdade na etica de epicuro,epicuro de samos ac foi um dos mais importantes pensadores da antiguidade o filosofo do jardim como ficou conhecido teria escrito pelo menos volumes tendo vivido em uma grecia sem a autonomia de outrora viu a mitigacao do sentido de liberdade eleutheria no campo social alem disso a teoria atomistica que lhe antecedia e o influenciou postulava a existencia tao somente da necessidade ananke operando na physis engendrando um consequente fatalismo que se estenderia ao campo das acoeshumanas reiterando a negacao da eleutheriae nesse contexto que ele vai a partir da physiologia dar contornos originais ao estudo da physis para poder postular a existencia do acaso tyche operando no mundofisico e da liberdade no agirhumano se faz isso e porque entende que ser livre e condicao para a felicidade e esta reside no prazer para isso epicuro vai admitir o indeterminismo no ambito da physiologia afiancando a existencia de um movimento de declinacao do atomo  o parenklisisnesse trabalho entao faremos uma analise de como se da a nocao de eleutheria desenvolvida no pensamento epicureo e como ela se articula com seu projeto de etica em especial discutiremos como a partir da physiologia epicuro vai pensar um ethoslivre voltado para a realizacao do prazer para a vidafeliz para tanto nos valemos da carta a herodoto da carta a pitocles da carta a meneceu das sentencas vaticanas das maximas capitais e de relatos doxograficos,0.9275850486261369
