document,topic,nm_producao,ds_resumo,gamma
9194,58,bayesianismo e o problema da inducao uma avaliacao critica da abordagem de colin howson,objetivamos avaliar a razoabilidade da abordagem bayesiana de colin howson ao problema da inducao tal como formulado por david hume propomos que uma abordagem ao problema da inducao sera razoavel se nossa compreensao da inducao nao regride em relacao aquela fornecida por hume por sua vez o bayesianismo e uma corrente teorica derivada da adocao das teses conhecidas como gradualismo probabilismo e revisao pela condicionalizacao seu merito e fornecer um modelo para representar e atualizar graus de crenca em seu turno o problema da inducao configurase como a busca para justificar racionalmente argumentos indutivos tendo em vista a tese humeana segundo a qual e impossivel fazelo seja mediante argumentos demonstrativos seja mediante argumentos provaveis para satisfazer a nosso objetivo esta dissertacao dividese em quatro capitulos no primeiro capitulo expomos o problema da inducao e como howson o interpreta no segundo capitulo comentamos propostas de solucao ao problema da inducao analisadas,0.9472747831127256
2907,58,da inferencia causal e principios formadores da crenca segundo pressupostos humeanos,ao buscar os fundamentos do entendimentohumano david hume realiza uma explicacao contumaz da mente como se conhece e a questao norteadora que rege o seu itinerario filosofico um itinerario regido pela experiencia ordinaria cotidiana para tanto o filosofo pressupoe um atomismo digamos ontologico o qual e pecachave no encadeamento dos motivos que busca desenvolve para compor os elementos de seu sistema motivos esses nao metafisicos certamente hume desvela em todos os aspectos a submissao da razao frente as nossas sensacoes de sentimentos nao se entristece com isso no entranto pelo contrario seu aparente ceticismo e uma arma eficiente contra todo e qualquer pensamento supersticioso apesar da medida certa de seu ceticismo nao ser algo acordado entre seus comentadoresenfim da analise geral do funcionamento da mente a explicacao especifica da inferencia causal hume descobre o habito como o grande guia da vidahumana a causa fundamental mas nao a ultima de nossas crencas causasis tal principio justifica um modo de crer e de agir muito distantes de qualquer ditame racional emborara tenhamis boas razoes para crer no que cremos e para agir como agimos,0.9468356692302256
4693,58,regras gerais e racionalidade em hume,hume no tratado da naturezahumana afirma haver duas formas de o habito atuar na producao de inferencias a saber conforme principios regulares e irregulares da imaginacao em decorrencia estipula determinadas regras gerais para marcar a atuacao do habito no primeiro modo restringindo a ela o espaco da causa e efeito a intencao desta tese e investigar o estatuto dessas regras bem como as suas consequencias quanto ao estabelecimento das fronteiras entre a razao e a imaginacao tratase de questionar inicialmente qual e o parametro que permite uma separacao nos juizos entre operacoes regulares e irregulares da imaginacao considerandose que hume mostra nao haver uma justificativa racional para a relacao de causa e efeito em contrapartida pretendese indicar em que medida uma nova nocao de racionalidade experimental econfigurada a partir da interposicao desse novo criterio bem como discutir como e tambem a estabilizacao do agir do entendimento sobre a imaginacao que se encontra no horizonte da normatividade instaurada pela regulacao via regras gerais do juizo,0.9465399001116923
11698,59,a justica a partir do absurdo e da revolta em albert camus,o presente trabalho tem por objetivo explicitar o conceito e as caracteristicas da justica a partir do absurdo e da revolta eixos centrais da analise existencial promovida por albert camus nos ensaios le mythe de sisyphe e lhomme revolte apesar de recorrente a tematica apresentase difusa e carente de delimitacao especifica os estudos acerca do tema atribuem a preocupacao de camus com a justica a uma inclinacao mais pessoal e politica do que filosofica a reconstituicao da analise existencial promovida nos ensaios demonstra porem a estreita relacao entre a justica e os atributos existenciais a fixacao de um conceito valido de justica so pode emergir a partir do absurdo e da revolta eixos centrais do pensamento do autor francoargelino considerada a finalidade da pesquisa operase a reconstituicao da analise existencial retomado o absurdo como ponto de partida ate culminar com a revolta como resultado o absurdo revela desde o inicio que o esvaziamento da justica e caracteristico da condicaohumana a revolta por sua vez consistira no impulso voltado a construcao da justica da qual o homem e por constituicao carente ao final e possivel sustentar que a justica para camus assim como o absurdo corresponde a uma paixao cuja satisfacao impossivel nao constitui empecilho a construcao da justica humana na revolta as caracteristicas da justica camusiana diferenciamse de acordo com a posicao assumida nos ensaios como paixao a injustica aponta para uma imperfeicao ontologica do homem incapaz de encontrar satisfacao integral aos seus desejos como construcao humana sera o resultado da paixao frustrada por justica e por isso imperfeita e limitada mas a unica salvacaohumana possivel,0.9666205464598787
9321,59,transcendencia intramundana na luta por reconhecimento uma apreciacao acerca dos potenciais transformativos na teoria normativa de axel honneth em perspectiva com o arquetipo hegelomarxista,quais os potenciais de transformacao a teoriacritica poderia ainda suscitar em tempos de esvaziamento da ideia de proletariado a teoria normativa precisa pressupor um ideal expectacional para amparar a pratica emancipatoria esse ideal precisaria nao obstante para comportar certa dinamica transformativa incluente da praxis comprometerse com a negacao do campo das expectativas normativas isto e do plano da justificacao das demandas por uma vidaboa analisando essa dificuldade propria de uma critica com exigencias de transcendencia intramundana especialmente pelo prisma da teoria do reconhecimento de axel honneth verificamos que o autor buscaria juntar tanto a essencialidade dos conflitos como a ideia de normatividade na luta por reconhecimento a fim de poder fazer uma leitura racional e ainda fiel ao projeto de modernidade da sociedade verificamos assim que honneth apesar de agregar o conflito e a dinamica de demandas possivelmente indeterminadas como questoes para a teoria do reconhecimento,0.9535656941503916
10416,59,a luta por reconhecimento em honneth perspectivas de uma filosofia social,siqueira matheus genske a luta por reconhecimento em honneth perspectivas de uma filosofia social dissertacao mestrado em filosofia universidade federal de pelotas pelotas a dissertacao se centra na categoria do reconhecimento em honneth em busca de perspectivas de uma teoriasocial nesse sentido honneth investiga os pressupostos indispensaveis que fazem emergir a categoria do reconhecimento enquanto criterio para a justica atraves disso honneth busca no jovem hegel de jena reinterpretar o conceito de eticidade como fundamento para uma filosofia social e apresenta a categoria do conflito como base do conceito de luta por reconhecimento social nesta reconstrucao o autor tambem avalia os elementos que incidem na indeterminacao da liberdadeindividual esse diagnostico permite a honneth identificar o deficit sociologico da teoriacritica para que isso possa ser feito honneth diz que o conflito intersubjetivo permite que os sujeitos busquem o reconhecimento ou seja por meio da luta por reconhecimento e na busca da autorrealizacao de suas capacidades e que o sujeito sera capaz de construir sua autonomia sua integridade a partir disso honneth distingue as diferentes esferas intersubjetivas encontradas no conceito de eticidade e apresentara os principiosfundamentais para o surgimento de uma teoriasocial motivada pela luta por reconhecimento social,0.9511057178406197
9896,59,fundamentos eticofilosoficos do modelo de justica retributiva em questao os desafios lancados pela justica restaurativa,o estudo do tema dos fundamentos eticofilosoficos da justica retributiva tem por objetivos aprofundar a compreensao dos pressupostos desse modelo que foram substancialmente estabelecidos por kant nas obras fundamentacao da metafisica dos costumes e metafisica dos costumes e questionar a coerencia e razoabilidade do principio da obrigatoriedade da punicao na atualidade o imperativo logico da punicao sera problematizado no contexto do ressurgimento das praticas de justica restaurativa no ultimo quarto do seculoxx que ensejou vigorosa interpelacao ao sistema oficial de justica para que fosse promovida a reparacao dos danos e o restabelecimento da alteridade violada das vitimas e tambem para que fosse adotado um procedimento dialogal menos violento a fim de satisfazer as necessidades de reconhecimento mutuo em relacao a todas as pessoas afetadas pelo conflito foi empregada a metodologia de pesquisa bibliografica descritiva hermeneutica tendo por hipotese a viabilidade de se flexibilizar o imperativo logico da punicao sempre que for possivel instaurar um procedimento restaurativo em prol do imperativo de justica tal como e percebido na racionalidade contemporanea a analise do paradigma da responsabilizacao restaurativa seguira a delimitacao proposta na vertente minimalista da justica restaurativa apresentada por howard zehr em sua obra trocando as lentes as interpelacoes ao modelo de justica retributiva que emanam das praticas de justica restaurativa serao apresentadas no horizonte etico da alteridade e do reconhecimento levando em conta as criticas a razaoinstrumental e as instituicoes repressivas que marcam a atualidade a necessidade do estudo se justifica a partir da constatacao que o principio da obrigatoriedade da punicao constitui um forte obice ao desenvolvimento das praticas de justica restaurativa por restringir a sua aplicacao aos crimes de menor potencial ofensivo e aquelas condutas que o sistema nao considera crime a exemplo dos atos infracionais praticados por adolescentes os estudos cientificos que tem pensado a questao limitamse a constatar que a justica retributiva tem um paradigma punitivo e que se contrapoe ao paradigma da responsabilizacao proposto pela justica restaurativa nao ha registros de trabalhos no brasil reexaminando a coerencia do imperativo da punicao a luz das interpelacoes que passam a ser articuladas apos a disseminacao das praticas restaurativas num contexto de valorizacao da alteridade do dialogo e do reconhecimento o estudo conclui pela necessidade e pertinencia de atualizar o paradigma retributivo flexibilizando o imperativo da obrigatoriedade da punicao de modo que a responsabilizacao restaurativa seja a primeira e a preferencial resposta do sistema de justica para o crime relegandose a punicao a ultima ratio a ser aplicada exclusivamente nos casos em que nao for possivel a composicao restaurativa do conflito essa flexibilizacao ha de catalisar a expansao das praticas restaurativas e dos valores da cultura de paz que lhe sao subjacentes em proveito da cidadania e da emancipacao do ser humano,0.9446641807324248
11260,59,pena de prisao reflexoes eticofilosoficas sobre a teoria dos fins da pena alternativas e os principios limitadores da intervencao punitiva do estado,a presente dissertacao procura viabilizar a concretizacao de um olhar eticofilosofico sobre a punicao tema polemico e milenar mas sempre atual que tem ao longo do tempo acarretado calorosos debates justificacoes e explicacoes sobre os fins da pena de prisao nao se procura fazer uma digressao historica da pena porque esta pesquisa nao se destina a produzir ao final mais um manual sobre a pena de prisao como punicao esta que antes do iluminismo se voltava para a mutilacao decapitacao esquartejamento enforcamento e queima em praca publica para uma melhor compreensao do sentido da pena de prisao como punicao procurouse estipular e trabalhar a partir do marco divisorio do que veio a se caracterizar como o da humanizacao das penas que e marcado pelo antropocentrismo caminhase pelo direitopositivo na via crucis das teorias dos fins da pena que dizem respeito a para que e por que punir essas teorias vem sendo construidas depois que o homem passou a ser o centro do universo para sob um olhar critico seja possivel desenvolver um melhor entendimento e compreensao das doutrinas de justificacao da pena com isso tratamse dos principios limitadores da intervencao estatal e da pena de prisao como punicao para melhor encontrar respostas a como punir de forma a se permitir a construcao de um discurso eticofilosofico que afaste a objecao kantiana de que nenhuma pessoa pode ser utilizada como meio afinal como corretamente alerta luigi ferrajoli a unica coisa que se pode pretender do carcere e que ele seja o menos repressivo e dessocializante possivel o direito de punir do estado tem que ter respostas as perguntas antecedentes por que punir para que punir como punir procurouse investigar o que torna justo ou justificavel aceitavel moralmente eou politicamente que se agregue a violencia ilegal do delito a legalidade da pena como punicao e investigar igualmente as justificacoes internas e externas da pena assim como analisar filosoficamente os varios estatutos epistemologicos dos problemas expressos por meio da questao basica do como punir afinal como bem frisa luigi ferrajoli o problema da justificacao da pena e classico por excelencia da filosofia do direito,0.9431972721363391
8725,60,percepcao e imaginacao em aristoteles,no capitulo do livroiii do de anima aristoteles contrapoe percepcao sensivel aisthesis e imaginacao phantasia diferenciandoas segundo certas carateristicas nesse mesmo capitulo o filosofo define a phantasia como uma especie de movimento derivado da percepcao sensorial em ato e que a phantasia permanece na alma apos esse ato contudo nao e claro seja nas linhas aristotelicas seja no comentario dos especialistas como ocorre exatamente esse processo de formacao das imagens phantasmata junto a assimilacao das formas sensiveis aistheton eidon nem como os phantasmata se diferenciam das sensacoes percebidas aisthemata ja que as formas sensiveis e os phantasmata sao imateriais a partir dessa problematica investigamos em que medida os phantasmata se diferenciam dos aisthemata a partir de tres caracteristicas principais por outrolado o estudo dessa diferenciacao acaba por delinear quais sao os atributos fundamentais da phantasia que a tornam inseparavel do pensamento bem como explicita a su,0.9451829888627926
4990,60,sensoperceocao no de anima de aristoteles,a analise da sensopercepcao e fundamental para a compreensao da proposta cognitiva de aristoteles bem como para a eficiencia do complexo da cognicao para compreendela e necessario comecar pelo estudo da relacao entre corpo e alma integrados nos conceitos constitutivos da teoria hilemorfica a saber materia forma ato potencia mas o hilemorfismo e uma teoria mereologica o funcionamento do todo e assegurado pelo funcionamento analogo de cada uma das partes a faculdade sensoperceptiva e a que primeiro caracteriza o animal e deve ser compreendida segundo a teoria hilemorfica a sensopercepcao ocorre em ato quando o sentido  que enquanto potencia e capaz de receber formas sensiveis  e movido conforme o movimento do meio advindo do ato do percebido por isso a sensopercepcao consiste em receber a forma sensivel sem a materia ao final desse processo o percipiente tornase igual a forma do percebido mas apenas a sensopercepcao dos proprios pode ser infalivel porque conecta dois atos da percepcao e do percebido ja a imaginacao e um movimento decorrente do ato da percepcao sensivel e um complexo de operacoes cuja funcao e ligar a sensacao ao pensamento essa funcao positiva e compensada por outra negativa de estabelecer as condicoes de possibilidade do engano e da falsidade sobre ela incidem os dois pensamentos passivo e produtivo enquanto o primeiro capta os produtos da sintese da sensopercepcao e imaginacao ao segundo cabe a funcao de garantir que o produto final da cognicao reproduz a realidade tal como ela e consumando o ato cognitivo perfeito palavraschave aristoteles sensopercepcao hilemorfismo cognicao,0.9447267767223879
8370,60,a phantasia na teoria aristotelica da alma sentidos e dimensoes,este trabalho tem por objeto abordar o problema da multiplicidade de sentidos atrelados ao termo phantasia nas obras de aristoteles voltadas para o tema da alma apos introduzir as principais tendencias de interpretacao sobre a phantasia aristotelica encontradas na literatura secundaria buscase na primeira parte demonstrar a centralidade da nocao de movimento intrapsiquico para os sentidos psicologicos do termo na parte seguinte abordase o sentido nao psicologico de phantasia evidenciandose suas dimensoes filosoficas para tanto lancase mao do estudo de tratados como de sensu et sensibilibus de caelo metereologica e de coloribus no capitulo final empreendese uma analise filosoficosemantica das formas vocabulares do de anima a fim de tornar claro o quao arraigado e o vinculo entre phantasia psicologica e movimento na teoria aristotelica da alma apos essa analise filosofico semantica as descricoes enunciadas em a a sao estudadas a luz dos segundos analiticos e dos topicos,0.9399745153536063
9837,60,a analise de alva noe de um experimento neurocientifico reflexao acerca da substituicao sensorial visual,o intuito desta dissertacao e apresentar a analise do filosofo alva noe acerca do aparelho de substituicao tatil visual o tvss criado pelo neurocientista paul bachyrita de modo a responder a seguinte questao o cego realmente experiencia a visao ao utilizar o tvss para tanto e necessario entender as teorias as quais baseiam o ponto de vista filosofico de noe acerca da percepcao visual bem como a importancia do tvss no desenvolvimento de respostas para exercicios mentais filosoficos tal como o problema de molyneux o aparelho de tvss e uma protese visual constituida por uma camera um receptor de sinais o qual converte os sinais visuais para tateis e um eletrodo conectado a pele do usuario nos modelos atuais o eletrodo adaptado a lingua do usuario recebe sinais eletricos e estes sao interpretados pelo cerebro enquanto sinais tateis pelo cortex somatorio sensorial apos um tempo de adaptacao os sinais sao percebidos como visuais tal experimento inspirou filosofos e psicologos a retomarem a questao de molyneux a locke a saber se um cego congenito o qual viveu sua vida aprendendo a distinguir objetos apenas com o tato caso tivesse sua visao restaurada poderia reconhecer entre a esfera e o cubo qual e qual e tambem nomealos corretamente enquanto filosofos empiristas como locke berkeley e molyneux responderam negativamente a questao alegando que o cego precisa adquirir experiencia com o novo canal perceptual filosofos racionalistas como leibniz synge e lee responderam positivamente pois de acordo com o racionalismo o cego seria capaz de reconhecer e nomear corretamente os objetos pois ja possuiria os conceitos preconcebidos na mente psicologos como morgan warren e strelow utilizaram aparelhos de substituicao sensorial para responder a molyneux e suas respostas corroboram locke por demonstrar que os cegos precisam de um tempo de adaptacao aos aparelhos alva noe por sua vez atribui uma resposta positiva ao tvss devido as contingencias sensorio motoras do usuario ou seja de acordo com sua teoria perceptual intitulada de abordagem da enacao para perceber e necessario agir deste modo e movimentando os olhos aproximandose de fontes de sons ou de odores que somos capazes de perceber de acordo com o filosofo perceber e agir e utilizando nossas habilidades motoras que somos capazes de perceber tal teoria e inspirada na teoria perceptual de nome similar de varela thompson e que por sua vez tem bases na fenomenologia de merleauponty a qual compreende o serhumanocomo um sernomundo munido de uma percepcao enquanto corporificada e envolvido no contexto em que esta inserido a partir destas caracteristicas a teoria de noe portanto atribui uma resposta positiva a questao proposta uma vez que o tvss possibilita de acordo com o filosofo uma especie de visao devido as similaridades do funcionamento perceptual tatil com o visual humano a abordagem da enacao de alva noe portanto aceita o funcionamento do tvss enquanto visao pois tal teoria permite uma aproximacao entre a percepcao tatil proporcionada pelo aparelho e a visao pois ambas as percepcoes utilizam de conhecimentos sensorios motores,0.935410429073336
2729,60,o nous no tratado da alma de aristoteles,pretendemos por meio deste trabalho expor nossa investigacao sobe o nous ou seja sobre o intelecto em aristoteles partimos assim de uma analise do de anima tratado de psicologia no qual o estagirita explicita esta teoria a primeira parte de nossa dissertacao consta de uma investigacao do desenvolvimento dos argumentos de aristoteles acerca do intelecto antes mesmo de sua explicitacao em da iii na segunda parte avancamos em direcao a uma analise da faculdade intelectiva em relacao a faculdade sensitiva dado que aristoteles inicia seu exame da parte intelectiva da alma por meio de uma analogia entre esta e a sensacao buscamos a partir daqui estabelecer algumas semelhancas e diferencas entre a sensacao e a inteleccao a terceira parte dizrespeito a analise do intelecto separado e a relacao deste com a sensacao no caso da inteleccao humana,0.9345471605195275
10343,61,orthos logos a educacao moral em aristoteles,aristoteles aborda questoes intrincadas da filosofiamoral na sua teoria das virtudes ao investigar o papel da razao no agirhumano o filosofo promove um debate aprofundado sobre o que ele considera o ponto chave da acao virtuosa ou seja a acao pautada com base na mediania algo entre o excesso e a falta ao longo do debate surge uma questao polemica algo que aristoteles denomina `orthos logos traduzido comumente como `razao correta meu esforco nesta dissertacao de mestrado e investigar o que vem a ser na filosofiamoral de aristoteles o orthos logos como e possivel o seu desenvolvimento na alma humana o objetivo e compreender como o `orthos logos habilita a parte da alma humana naoracional a identificar e determinar o fim moral a dificuldade do tema surge quando aristoteles afirma que ao seguir o comando da razao a acaohumana encontra a virtude e a `razao correta e por isso imprescindivel ao agir virtuoso grande parte dos interpretes traduz `orthos logos como `razao correta entao como e possivel algo considerado como racional pertencer a parte da alma nao racional eis aqui o meu principal desafio investigarei de que modo o `orthos logos encontra o meiotermo seguindo os comandos da virtude do carater e assegurando portanto a realizacao da acao correta pretendo tambem demonstrar como o `orthos logos enquanto peca fundamental do agir virtuoso pode ser considerado o cerne da educacaomoral aristoteles nao o define diretamente mas e evidente a sua importancia para a formacao do carater,0.9638948209212387
8817,61,virtude do carater e phronesis na ethica nicomachea,na obra ethica nicomachea aristoteles faz as seguintes afirmacoes o fim nao e objeto de deliberacao mas aquelas coisas que conduzem ao fim en b e que a virtude faz o alvo ser correto ao passo que a phronesis faz ser correto aquilo que leva ao alvo en a um problema que se coloca com essas afirmacoes e que os fins adotados por um agente moral nao parecem ser objeto de escolha racional uma vez que a deliberacao um procedimento racional esta fadada a lidar apenas com as coisas que conduzem aos fins enquanto que os fins por seu turno recaem sob a alcada da virtude do carater que e descrita por aristoteles como uma virtude da parte naoracional da alma o objetivo desta dissertacao e compreender como aristoteles sustenta tais afirmacoes de que modo ele compreende as relacoes entre virtude do carater e phronesis e como essas duas virtudes se articulam na delimitacao dos fins e das coisas que conduzem ao fim,0.9553603603040823
6240,61,o papel das emocoes e do habito na formacao moral,a presente pesquisa busca compreender e tentar atualizar alguns dos principais conceitos da teoria das virtudes de aristoteles articulando o papel das emocoes dos sentimentos de dor e prazer na formacao do carater pela pratica de bons habitos relacionando com a experiencia educativa contemporanea particularmente o exemplo da literatura infantil apoiada na teoria aristotelica e nas explicacoes e comparacoes de comentaristas a abordagem busca expor e analisar algumas questoes que orientam a investigacao tais como qual e o papel das emocoes e do habito no agirmoral o que significa educar para uma vida virtuosa e feliz como ocorre a relacao da parte da alma racional com a parte irracional ao defender que o carater e moldado na pratica habitual que exige tempo experiencia sabios conselhos bons exemplos e o habituarse ao certo bom e justo aristoteles faz refletir sobre a educacao que temos e a educacao que desejamos para as nossas criancas serem futuros cidadaos virtuosos considerando que somos,0.9527201127163022
